{
  "format": "tw.atlas-selection/0.2",
  "version": "2026-08-10",
  "status": "candidate_selection",
  "canonical_scheme": "https",
  "statement": "Candidate selection only. Selection does not assert reachability, access permission, publisher identity, authority, completed policy review, profiling, observation, compilation, semantic admission, health, or live availability.",
  "family_quotas": {
    "government_law_public_data": 100,
    "science_research_scholarly_infrastructure": 80,
    "standards_technical_docs_open_source": 60,
    "economics_markets_public_disclosure": 60,
    "journalism_public_interest": 50,
    "health_public_health": 50,
    "climate_environment_earth_systems": 50,
    "education_reference_culture": 30,
    "humanitarian_civic_global_development": 20
  },
  "candidates": [
    {
      "id": "data-gov",
      "canonical_origin": "https://data.gov",
      "canonical_host": "data.gov",
      "domain_family": "government_law_public_data",
      "catalog": {"state": "candidate"},
      "publisher_hint": null,
      "jurisdiction_hint": null,
      "language_hints": []
    },
    {
      "id": "census-gov",
      "canonical_origin": "https://census.gov",
      "canonical_host": "census.gov",
      "domain_family": "government_law_public_data",
      "catalog": {"state": "candidate"},
      "publisher_hint": null,
      "jurisdiction_hint": null,
      "language_hints": []
    },
    {
      "id": "bls-gov",
      "canonical_origin": "https://bls.gov",
      "canonical_host": "bls.gov",
      "domain_family": "government_law_public_data",
      "catalog": {"state": "candidate"},
      "publisher_hint": null,
      "jurisdiction_hint": null,
      "language_hints": []
    },
    {
      "id": "bea-gov",
      "canonical_origin": "https://bea.gov",
      "canonical_host": "bea.gov",
      "domain_family": "government_law_public_data",
      "catalog": {"state": "candidate"},
      "publisher_hint": null,
      "jurisdiction_hint": null,
      "language_hints": []
    },
    {
      "id": "regulations-gov",
      "canonical_origin": "https://regulations.gov",
      "canonical_host": "regulations.gov",
      "domain_family": "government_law_public_data",
      "catalog": {"state": "candidate"},
      "publisher_hint": null,
      "jurisdiction_hint": null,
      "language_hints": []
    },
    {
      "id": "congress-gov",
      "canonical_origin": "https://congress.gov",
      "canonical_host": "congress.gov",
      "domain_family": "government_law_public_data",
      "catalog": {"state": "candidate"},
      "publisher_hint": null,
      "jurisdiction_hint": null,
      "language_hints": []
    },
    {
      "id": "govinfo-gov",
      "canonical_origin": "https://govinfo.gov",
      "canonical_host": "govinfo.gov",
      "domain_family": "government_law_public_data",
      "catalog": {"state": "candidate"},
      "publisher_hint": null,
      "jurisdiction_hint": null,
      "language_hints": []
    },
    {
      "id": "usaspending-gov",
      "canonical_origin": "https://usaspending.gov",
      "canonical_host": "usaspending.gov",
      "domain_family": "government_law_public_data",
      "catalog": {"state": "candidate"},
      "publisher_hint": null,
      "jurisdiction_hint": null,
      "language_hints": []
    },
    {
      "id": "data-gov-uk",
      "canonical_origin": "https://data.gov.uk",
      "canonical_host": "data.gov.uk",
      "domain_family": "government_law_public_data",
      "catalog": {"state": "candidate"},
      "publisher_hint": null,
      "jurisdiction_hint": null,
      "language_hints": []
    },
    {
      "id": "ons-gov-uk",
      "canonical_origin": "https://ons.gov.uk",
      "canonical_host": "ons.gov.uk",
      "domain_family": "government_law_public_data",
      "catalog": {"state": "candidate"},
      "publisher_hint": null,
      "jurisdiction_hint": null,
      "language_hints": []
    },
    {
      "id": "legislation-gov-uk",
      "canonical_origin": "https://legislation.gov.uk",
      "canonical_host": "legislation.gov.uk",
      "domain_family": "government_law_public_data",
      "catalog": {"state": "candidate"},
      "publisher_hint": null,
      "jurisdiction_hint": null,
      "language_hints": []
    },
    {
      "id": "data-europa-eu",
      "canonical_origin": "https://data.europa.eu",
      "canonical_host": "data.europa.eu",
      "domain_family": "government_law_public_data",
      "catalog": {"state": "candidate"},
      "publisher_hint": null,
      "jurisdiction_hint": null,
      "language_hints": []
    },
    {
      "id": "eur-lex-europa-eu",
      "canonical_origin": "https://eur-lex.europa.eu",
      "canonical_host": "eur-lex.europa.eu",
      "domain_family": "government_law_public_data",
      "catalog": {"state": "candidate"},
      "publisher_hint": null,
      "jurisdiction_hint": null,
      "language_hints": []
    },
    {
      "id": "op-europa-eu",
      "canonical_origin": "https://op.europa.eu",
      "canonical_host": "op.europa.eu",
      "domain_family": "government_law_public_data",
      "catalog": {"state": "candidate"},
      "publisher_hint": null,
      "jurisdiction_hint": null,
      "language_hints": []
    },
    {
      "id": "data-gouv-fr",
      "canonical_origin": "https://data.gouv.fr",
      "canonical_host": "data.gouv.fr",
      "domain_family": "government_law_public_data",
      "catalog": {"state": "candidate"},
      "publisher_hint": null,
      "jurisdiction_hint": null,
      "language_hints": []
    },
    {
      "id": "insee-fr",
      "canonical_origin": "https://insee.fr",
      "canonical_host": "insee.fr",
      "domain_family": "government_law_public_data",
      "catalog": {"state": "candidate"},
      "publisher_hint": null,
      "jurisdiction_hint": null,
      "language_hints": []
    },
    {
      "id": "legifrance-gouv-fr",
      "canonical_origin": "https://legifrance.gouv.fr",
      "canonical_host": "legifrance.gouv.fr",
      "domain_family": "government_law_public_data",
      "catalog": {"state": "candidate"},
      "publisher_hint": null,
      "jurisdiction_hint": null,
      "language_hints": []
    },
    {
      "id": "govdata-de",
      "canonical_origin": "https://govdata.de",
      "canonical_host": "govdata.de",
      "domain_family": "government_law_public_data",
      "catalog": {"state": "candidate"},
      "publisher_hint": null,
      "jurisdiction_hint": null,
      "language_hints": []
    },
    {
      "id": "destatis-de",
      "canonical_origin": "https://destatis.de",
      "canonical_host": "destatis.de",
      "domain_family": "government_law_public_data",
      "catalog": {"state": "candidate"},
      "publisher_hint": null,
      "jurisdiction_hint": null,
      "language_hints": []
    },
    {
      "id": "gesetze-im-internet-de",
      "canonical_origin": "https://gesetze-im-internet.de",
      "canonical_host": "gesetze-im-internet.de",
      "domain_family": "government_law_public_data",
      "catalog": {"state": "candidate"},
      "publisher_hint": null,
      "jurisdiction_hint": null,
      "language_hints": []
    },
    {
      "id": "dati-gov-it",
      "canonical_origin": "https://dati.gov.it",
      "canonical_host": "dati.gov.it",
      "domain_family": "government_law_public_data",
      "catalog": {"state": "candidate"},
      "publisher_hint": null,
      "jurisdiction_hint": null,
      "language_hints": []
    },
    {
      "id": "istat-it",
      "canonical_origin": "https://istat.it",
      "canonical_host": "istat.it",
      "domain_family": "government_law_public_data",
      "catalog": {"state": "candidate"},
      "publisher_hint": null,
      "jurisdiction_hint": null,
      "language_hints": []
    },
    {
      "id": "normattiva-it",
      "canonical_origin": "https://normattiva.it",
      "canonical_host": "normattiva.it",
      "domain_family": "government_law_public_data",
      "catalog": {"state": "candidate"},
      "publisher_hint": null,
      "jurisdiction_hint": null,
      "language_hints": []
    },
    {
      "id": "datos-gob-es",
      "canonical_origin": "https://datos.gob.es",
      "canonical_host": "datos.gob.es",
      "domain_family": "government_law_public_data",
      "catalog": {"state": "candidate"},
      "publisher_hint": null,
      "jurisdiction_hint": null,
      "language_hints": []
    },
    {
      "id": "ine-es",
      "canonical_origin": "https://ine.es",
      "canonical_host": "ine.es",
      "domain_family": "government_law_public_data",
      "catalog": {"state": "candidate"},
      "publisher_hint": null,
      "jurisdiction_hint": null,
      "language_hints": []
    },
    {
      "id": "boe-es",
      "canonical_origin": "https://boe.es",
      "canonical_host": "boe.es",
      "domain_family": "government_law_public_data",
      "catalog": {"state": "candidate"},
      "publisher_hint": null,
      "jurisdiction_hint": null,
      "language_hints": []
    },
    {
      "id": "dados-gov-pt",
      "canonical_origin": "https://dados.gov.pt",
      "canonical_host": "dados.gov.pt",
      "domain_family": "government_law_public_data",
      "catalog": {"state": "candidate"},
      "publisher_hint": null,
      "jurisdiction_hint": null,
      "language_hints": []
    },
    {
      "id": "ine-pt",
      "canonical_origin": "https://ine.pt",
      "canonical_host": "ine.pt",
      "domain_family": "government_law_public_data",
      "catalog": {"state": "candidate"},
      "publisher_hint": null,
      "jurisdiction_hint": null,
      "language_hints": []
    },
    {
      "id": "diariodarepublica-pt",
      "canonical_origin": "https://diariodarepublica.pt",
      "canonical_host": "diariodarepublica.pt",
      "domain_family": "government_law_public_data",
      "catalog": {"state": "candidate"},
      "publisher_hint": null,
      "jurisdiction_hint": null,
      "language_hints": []
    },
    {
      "id": "data-overheid-nl",